<?xml version="1.0" encoding="ISO-8859-1"?>
<types xmlns:xsi="http://www.w3.org/2001/XMLSchema-instance"
	xsi:noNamespaceSchemaLocation="http://spot-next.io/schemas/v2/itemtypes.xsd">

	<collection elementType="UserData" name="UserDataList" />

	<!-- enums -->

	<enum name="UserType" package="io.spotnext.sample.types.enumerations">
		<value code="GUEST" />
		<value code="REGISTERED" />
	</enum>

	<bean name="UserData" package="io.spotnext.sample.types.beans">
		<properties>
			<property name="email" type="String" />
			<property name="name" type="String" />
			<property name="type" type="UserType" />
		</properties>
	</bean>
	
	<bean name="AddressData" package="io.spotnext.sample.types.beans">
		<properties>
			<property name="street" type="String" />
			<property name="postalCode" type="String" />
			<property name="city" type="String" />
			<property name="country" type="String" />
		</properties>
	</bean>
	
	<bean name="PartyData" package="io.spotnext.sample.types.beans">
		<properties>
			<property name="title" type="String" />
			<property name="motto" type="String" />
			<property name="location" type="AddressData" />
			<property name="date" type="LocalDate" />
			<property name="guests" type="UserDataList" />
		</properties>
	</bean>

	<!-- users and groups -->

	<type name="User" package="io.spotnext.itemtype.core.user">
		<properties>
			<property name="type" type="UserType">
				<annotations>
					<annotation javaClass="javax.validation.constraints.NotNull" />
				</annotations>
				<defaultValue>io.spotnext.sample.types.enumerations.UserType.REGISTERED
				</defaultValue>
			</property>
		</properties>
	</type>
	
	<type name="Party" package="io.spotnext.sample.types.itemtypes">
		<properties>
			<property name="title" type="String">
				<description>The unique title of the party</description>
				<modifiers unique="true" />
				<annotations>
					<annotation javaClass="javax.validation.constraints.NotNull" />
				</annotations>
			</property>
			<property name="motto" type="LocalizedString" localized="true">
				<description>The localized motto of the party</description>
			</property>
			<property name="location" type="Address">
				<description>The location the party will take place</description>
			</property>
			<property name="date" type="LocalDate">
				<description>The date the party will take place</description>
			</property>
			<property name="fixed" type="boolean">
				<description>Defines that the party has been fixed and should not be changed anymore.</description>
				<defaultValue>false</defaultValue>
			</property>
		</properties>
	</type>

	<relation name="Party2InvitedUser">
		<source itemType="Party" mappedBy="parties" cardinality="many">
			<description>The parties this user is invited.</description>
		</source>
		<target itemType="User" mappedBy="invitedGuests" cardinality="many">
			<description>The guests that are invited to this party.</description>
		</target>
	</relation>

</types>

