<?xml version="1.0" encoding="ISO-8859-1"?>
<types xmlns:xsi="http://www.w3.org/2001/XMLSchema-instance"
	xsi:noNamespaceSchemaLocation="http://spot-next.io/schemas/v1/itemtypes.xsd">

	<!-- enums -->

	<enum name="HtmlLinkTarget" package="io.spotnext.itemtype.cms.enumeration">
		<description>Represents an HTML link target used.</description>
		<value code="BLANK" />
		<value code="SELF" />
		<value code="PARENT" />
		<value code="TOP" />
	</enum>

	<enum name="Orientation" package="io.spotnext.itemtype.cms.enumeration">
		<description>Defines the orientation, eg. for layouts.</description>
		<value code="TOP" />
		<value code="BOTTOM" />
		<value code="LEFT" />
		<value code="RIGHT" />
	</enum>

	<enum name="TemplateRenderEngine" package="io.spotnext.itemtype.cms.enumeration">
		<description>The render engine used to render cms items.</description>
		<value code="VELOCITY" />
		<value code="FREEMARKER" />
		<value code="THYMELEAF" />
		<value code="JSP" />
	</enum>

	<!-- image media -->
	<type name="ImageMedia" extends="FileMedia" package="io.spotnext.core.model.media">
		<properties>
		</properties>
	</type>

	<!-- cms item types -->

	<type name="AbstractCmsItem" abstract="true" package="io.spotnext.itemtype.cms.model"
		extends="UniqueIdItem">
		<properties>
			<property name="catalog" type="Catalog">
				<description>The content catalog of the item.</description>
				<modifiers unique="true" />
				<validators>
					<validator javaClass="javax.validation.constraints.NotNull" />
				</validators>
			</property>
			<property name="onlyOneRestrictionMustApply" type="Boolean">
				<description>
					f set to true, only one restriction must evaluate to "show cms item" 
					for the item to be visible.
				</description>
			</property>
		</properties>
	</type>

	<type name="CmsRestriction" extends="AbstractCmsItem" package="io.spotnext.itemtype.cms.model">
		<properties>
			<property name="evaluator" type="String">
				<description>The spring bean id of the corresponding evaluator implementation.</description>
			</property>
			<property name="evaluatorScript" type="String">
				<description>The beanshell script that evaluates the cms item visibility.</description>
			</property>
		</properties>
	</type>

	<type name="AbstractCmsComponent" abstract="true" extends="AbstractCmsItem"
		package="io.spotnext.itemtype.cms.model">
		<properties>
			<property name="renderContextProvider" type="String">
				<description>
					The spring bean id of the context provider implementation.
				</description>
			</property>
			<property name="renderContextPreparationScript" type="String">
				<description>
				Beanshell code that is executed before the page rendering.
				It can be used to prepare the render context variables.
			</description>
			</property>
			<property name="content" type="String">
			</property>
			<property name="renderEngine" type="TemplateRenderEngine">
				<validators>
					<validator javaClass="javax.validation.constraints.NotNull" />
				</validators>
			</property>
		</properties>
	</type>

	<type name="AbstractCmsContainerComponent" abstract="true"
		extends="AbstractCmsComponent" package="io.spotnext.itemtype.cms.model">
		<properties>
		</properties>
	</type>

	<type name="CmsComponent" extends="AbstractCmsComponent" package="io.spotnext.itemtype.cms.model">
		<properties>
		</properties>
	</type>

	<type name="ContentSlot" extends="AbstractCmsItem" package="io.spotnext.itemtype.cms.model">
		<properties>
		</properties>
	</type>

	<type name="MetaTag" extends="ConfigEntry" package="io.spotnext.itemtype.cms.model">
	</type>

	<type name="CmsPageTemplate" extends="AbstractCmsContainerComponent"
		package="io.spotnext.itemtype.cms.model">
		<properties>
			<property name="title" type="LocalizedString">
			</property>
			<property name="favIconPath" type="LocalizedString">
			</property>
			<property name="favIcon" type="ImageMedia">
			</property>
			<property name="metaTags" type="StringList" />
		</properties>
	</type>

	<type name="CmsPage" extends="CmsPageTemplate" package="io.spotnext.itemtype.cms.model">
		<properties>
			<property name="urlMatches" type="StringList">
				<description>Holds the regex string to determine which URL should
						be handler by this page.</description>
			</property>
			<property name="template" type="CmsPageTemplate">
			</property>
		</properties>
	</type>

	<!-- special cms components -->

	<type name="AbstractNavigationEntry" abstract="true" extends="CmsComponent"
		package="io.spotnext.itemtype.cms.model">
		<properties>
			<property name="name" type="String">
				<description>The navigation entry name.</description>
			</property>
		</properties>
	</type>

	<type name="NavigationLinkEntry" extends="AbstractNavigationEntry"
		package="io.spotnext.itemtype.cms.model">
		<properties>
			<property name="href" type="String">
				<description>The href of the link.</description>
			</property>
			<property name="target" type="HtmlLinkTarget">
				<description>The HTML link target.</description>
			</property>
		</properties>
	</type>

	<type name="AbstractNavigationContainer" extends="AbstractCmsContainerComponent" abstract="true"
		package="io.spotnext.itemtype.cms.model">
		<properties>
		</properties>
	</type>

	<type name="NavigationBar" extends="AbstractNavigationContainer"
		package="io.spotnext.itemtype.cms.model" />

	<type name="Footer" extends="AbstractNavigationContainer" package="io.spotnext.itemtype.cms.model" />


	<relation name="AbstractCmsItem2CmsRestriction">
		<source itemType="AbstractCmsItem" cardinality="one" mappedBy="cmsItem" />
		<target itemType="CmsRestriction" cardinality="many" mappedBy="cmsRestrictions">
			<description>The restrictions evaluate if the current cms item should be rendered.</description>
		</target>
	</relation>

	<relation name="AbstractCmsContainerComponent2AbstractCmsComponent">
		<source itemType="AbstractCmsContainerComponent" cardinality="many"
			mappedBy="container" />
		<target itemType="AbstractCmsComponent" cardinality="many"
			mappedBy="components" />
	</relation>

	<relation name="ContentSlot2CmsComponent">
		<source itemType="ContentSlot" cardinality="many" mappedBy="contentSlot" />
		<target itemType="CmsComponent" cardinality="many" mappedBy="components" />
	</relation>

</types>